{
  "schema_version": 1,
  "profile_set_id": "english_course_level_exit_profiles",
  "version": 0,
  "status": "proposal",
  "exit_levels": ["a1", "a2", "b1", "b2", "c1", "c2"],
  "onboarding_support": {
    "level": "pre_a1",
    "role": "Diagnostic and remedial on-ramp for isolated words, formulaic expressions, and foundational recognition.",
    "exit_claim": false
  },
  "internal_milestones": [
    {"id": "a2_plus", "gse_range": "36-42", "role": "Internal progress milestone within the A2-to-B1 journey."},
    {"id": "b1_plus", "gse_range": "51-58", "role": "Internal progress milestone within the B1-to-B2 journey."},
    {"id": "b2_plus", "gse_range": "67-75", "role": "Internal progress milestone within the B2-to-C1 journey."}
  ],
  "lifecycle": ["expose", "introduce", "practise", "recycle", "consolidate", "extend"],
  "source_catalog": [
    {
      "source_id": "coe.cefr_companion_2020_en",
      "raw_file": "sources/raw/frameworks/cefr-companion-2020-en.pdf",
      "locations": ["page 175: global scale", "pages 177-181: expanded skill grid", "pages 131-142: language competences"],
      "role": "Primary broad level and qualitative boundary."
    },
    {
      "source_id": "pearson.gse_adult_general_english_2022",
      "raw_file": "sources/raw/frameworks/gse-learning-objectives-adult-general-english-2022.pdf",
      "locations": ["pages 7-8: GSE/CEFR bands", "pages 9-45: skill objectives"],
      "role": "Granular communicative objectives and internal progress ranges."
    },
    {
      "source_id": "english_profile.egp_online_export",
      "raw_file": "sources/raw/grammar/english-grammar-profile-online.xlsx",
      "locations": ["Data!A2:H1223"],
      "role": "Empirical English grammar features by CEFR level."
    },
    {
      "source_id": "pearson.gse_grammar_adult_2023",
      "raw_file": "sources/raw/grammar/gse-grammar-guide-adult-framework.pdf",
      "locations": ["pages 5-39: productive grammar inventory"],
      "role": "Secondary grammar and GSE cross-check."
    },
    {
      "source_id": "oxford.3000_by_cefr",
      "raw_file": "sources/raw/vocabulary/oxford-3000-by-cefr-level.pdf",
      "locations": ["pages 1-12: A1-B2 list"],
      "role": "Core lexical pool, not a mandatory syllabus order."
    },
    {
      "source_id": "oxford.5000_by_cefr",
      "raw_file": "sources/raw/vocabulary/oxford-5000-by-cefr-level.pdf",
      "locations": ["pages 1-8: B2-C1 additions"],
      "role": "Advanced lexical pool through C1; no C2 checklist."
    }
  ],
  "levels": [
    {
      "level": "a1",
      "gse_range": "22-29",
      "title": "Supported concrete communication",
      "exit_promise": "Handle concrete personal details and immediate needs with learnt language and a collaborative partner.",
      "reception": {
        "listening": "Recognise familiar words and very basic phrases when delivery is slow, clear, and context-supported.",
        "reading": "Understand familiar names, words, signs, and very simple sentences in predictable material."
      },
      "production": {
        "speaking": "Use isolated simple phrases and sentences for personal details, familiar people, places, possessions, and needs.",
        "writing": "Produce isolated phrases and sentences and complete very simple personal-detail forms or messages."
      },
      "interaction": {
        "oral": "Ask and answer simple questions with repetition, rephrasing, slower speech, and formulation help.",
        "written_online": "Post simple greetings or reactions and complete a very simple purchase or personal-details form.",
        "mediation": "Relay simple predictable information from short signs or notices and show welcome, interest, or understanding."
      },
      "language_control": {
        "range": "Very basic expressions and some one-clause structures for concrete personal information and needs.",
        "grammar": "Limited control of a few learnt simple structures and sentence patterns.",
        "vocabulary": "Basic words and phrases tied to particular concrete situations.",
        "pronunciation": "A limited learnt repertoire is intelligible with effort and collaborative support.",
        "discourse": "Link words or groups mainly with very basic linear connectors such as and or then.",
        "fluency": "Manage very short pre-packaged utterances with substantial pausing and repair."
      },
      "assessment_evidence": ["A new concrete personal or immediate-need task", "No copying of a complete model", "Support may clarify but not supply the response"],
      "source_refs": ["coe.cefr_companion_2020_en", "pearson.gse_adult_general_english_2022", "english_profile.egp_online_export", "oxford.3000_by_cefr"],
      "decision_state": "needs_review"
    },
    {
      "level": "a2",
      "gse_range": "30-42",
      "title": "Routine direct communication",
      "exit_promise": "Complete simple routine exchanges and describe the immediate world through linked simple language.",
      "reception": {
        "listening": "Understand high-frequency language of immediate relevance and the main point of short clear messages.",
        "reading": "Read short simple texts and locate predictable information in everyday materials and personal correspondence."
      },
      "production": {
        "speaking": "Use a series of simple phrases and sentences to describe family, background, routines, and immediate surroundings.",
        "writing": "Produce a series of simple phrases and sentences linked by frequent connectors."
      },
      "interaction": {
        "oral": "Complete routine tasks and short social exchanges through direct familiar information exchange.",
        "written_online": "Handle basic social interaction, routine transactions, simple instructions, and supported collaboration.",
        "mediation": "Convey main points of short simple everyday texts and collaborate on practical tasks with occasional repetition."
      },
      "language_control": {
        "range": "Basic patterns and memorised phrases for predictable everyday content, with message compromise outside routine situations.",
        "grammar": "Some simple structures are correct, though systematic basic mistakes remain and meaning is usually clear.",
        "vocabulary": "Sufficient for routine transactions, basic communicative needs, and simple survival situations.",
        "pronunciation": "Generally understandable in familiar situations, though repetition and listener effort may be needed.",
        "discourse": "Link simple sentences with frequent connectors such as and, but, and because.",
        "fluency": "Make short understandable contributions with visible hesitation, false starts, and reformulation."
      },
      "assessment_evidence": ["A new routine transaction", "A short linked description", "Successful repair after a bounded misunderstanding"],
      "source_refs": ["coe.cefr_companion_2020_en", "pearson.gse_adult_general_english_2022", "english_profile.egp_online_export", "oxford.3000_by_cefr"],
      "decision_state": "needs_review"
    },
    {
      "level": "b1",
      "gse_range": "43-58",
      "title": "Connected familiar independence",
      "exit_promise": "Operate independently in familiar life, travel, work, and personal-interest situations using connected language.",
      "reception": {
        "listening": "Understand main points of clear standard input and relatively clear media on familiar or personally relevant topics.",
        "reading": "Understand high-frequency everyday or job-related texts and descriptions of events, feelings, and wishes."
      },
      "production": {
        "speaking": "Connect phrases to narrate experiences and events and give brief reasons for opinions, hopes, and plans.",
        "writing": "Produce straightforward connected text on familiar or personally interesting topics."
      },
      "interaction": {
        "oral": "Enter unprepared conversation on familiar topics and handle most common situations while travelling.",
        "written_online": "Interact about experiences and feelings, ask for clarification, and answer comments in some detail.",
        "mediation": "Convey familiar information from clear texts, seek simple compromise, and support shared communication."
      },
      "language_control": {
        "range": "Sufficient familiar-topic language for some unpredictable situations, with hesitation and circumlocution when limits appear.",
        "grammar": "Reasonable accuracy in familiar contexts; errors and first-language influence remain but intended meaning is clear.",
        "vocabulary": "Good range for familiar topics and everyday life, with limitations on unfamiliar or complex ideas.",
        "pronunciation": "Generally intelligible despite regular mispronunciation and noticeable first-language influence.",
        "discourse": "Link shorter elements into a connected linear sequence with simple paragraphing and chronological control.",
        "fluency": "Keep going comprehensibly despite evident pauses for planning and repair."
      },
      "assessment_evidence": ["An unscripted familiar problem", "A connected narrative", "A reasoned response in more than one context"],
      "source_refs": ["coe.cefr_companion_2020_en", "pearson.gse_adult_general_english_2022", "english_profile.egp_online_export", "oxford.3000_by_cefr"],
      "decision_state": "needs_review"
    },
    {
      "level": "b2",
      "gse_range": "59-75",
      "title": "Detailed independent communication",
      "exit_promise": "Understand and produce clear detailed language, sustain viewpoints, and interact with useful spontaneity.",
      "reception": {
        "listening": "Follow extended talk and complex argument on reasonably familiar topics and understand most standard-language news and film.",
        "reading": "Understand articles and reports with viewpoints, contemporary prose, and relevant technical discussion."
      },
      "production": {